{
  "material_version": "aau-python-execution-materials/0.1",
  "capture_mode": "static_local_python_imports",
  "entrypoint": "agent-side-effect-ledger/examples/reference_adapter.py",
  "materials": [
    {
      "source_path": "agent-side-effect-ledger/aau_side_effect.py",
      "role": "static_local_python_import",
      "size_bytes": 45343,
      "sha256": "f1b4e1958048e66837b62681ad89d2344e43395cd5ff374fd0933b4557c37404",
      "content_base64": "IiIiT2ZmbGluZSByZWZlcmVuY2UgbGVkZ2VyIGZvciByZXRyeS1zYWZlLCBhcHByb3ZhbC1ib3VuZCBhZ2VudCBzaWRlIGVmZmVjdHMuIiIiCgpmcm9tIF9fZnV0dXJlX18gaW1wb3J0IGFubm90YXRpb25zCgppbXBvcnQgYXJncGFyc2UKaW1wb3J0IGhhc2hsaWIKaW1wb3J0IGpzb24KaW1wb3J0IHJlCmltcG9ydCBzaGxleAppbXBvcnQgc2h1dGlsCmltcG9ydCBzdWJwcm9jZXNzCmltcG9ydCBzeXMKZnJvbSBkYXRhY2xhc3NlcyBpbXBvcnQgZGF0YWNsYXNzLCBmaWVsZApmcm9tIHBhdGhsaWIgaW1wb3J0IFBhdGgKZnJvbSB0eXBpbmcgaW1wb3J0IEFueQoKClNVSVRFX1ZFUlNJT04gPSAiYWF1LWFnZW50LXNpZGUtZWZmZWN0LXN1aXRlLzAuMSIKUkVDRUlQVF9WRVJTSU9OID0gImFhdS1hZ2VudC1zaWRlLWVmZmVjdC1yZWNlaXB0LzAuMSIKUEFDS19WRVJTSU9OID0gImFhdS1hZ2VudC1zaWRlLWVmZmVjdC1wYWNrLzAuMSIKQ09ORk9STUFOQ0VfUkVDRUlQVF9WRVJTSU9OID0gImFhdS1hZ2VudC1zaWRlLWVmZmVjdC1jb25mb3JtYW5jZS1yZWNlaXB0LzAuMSIKQURBUFRFUl9QUk9UT0NPTF9WRVJTSU9OID0gImFhdS1hZ2VudC1zaWRlLWVmZmVjdC1hZGFwdGVyLzAuMSIKTUFYX0JZVEVTID0gMl8wMDBfMDAwCk1BWF9BREFQVEVSX0JZVEVTID0gMV8wMDBfMDAwClpFUk9fSEFTSCA9ICIwIiAqIDY0ClRSQUNFUEFSRU5UID0gcmUuY29tcGlsZShyIl4wMC1bMC05YS1mXXszMn0tWzAtOWEtZl17MTZ9LVswLTlhLWZdezJ9JCIpCkVWRU5UX0tJTkRTID0geyJwcmVwYXJlIiwgImFwcHJvdmUiLCAiY29tbWl0IiwgInJlY29uY2lsZSIsICJjb21wZW5zYXRlIn0KT1VUQ09NRVMgPSB7CiAgICAicHJlcGFyZWQiLAogICAgImFwcHJvdmVkIiwKICAgICJjb21taXR0ZWQiLAogICAgImR1cGxpY2F0ZV9yZXBsYXllZCIsCiAgICAiYmxvY2tlZCIsCiAgICAicmVjb25jaWxlX3JlcXVpcmVkIiwKICAgICJyZWNvbmNpbGVkX2NvbW1pdHRlZCIsCiAgICAicmVjb25jaWxlZF9hYnNlbnQiLAogICAgImNvbXBlbnNhdGVkIiwKfQpCT1VOREFSWV9LRVlTID0gewogICAgInN5bnRoZXRpY19leGVjdXRvcl9vbmx5IiwKICAgICJub19saXZlX3RhcmdldCIsCiAgICAibm9fdG9vbF9leGVjdXRpb24iLAogICAgIm5vX25ldHdvcmtfYWNjZXNzIiwKICAgICJub3RfZXhhY3RseV9vbmNlX2NsYWltIiwKICAgICJjb21wZW5zYXRpb25fZG9lc19ub3RfZXJhc2Vfb3JpZ2luYWwiLAogICAgImh1bWFuX2FwcHJvdmFsX3JlcXVpcmVkIiwKfQpDT05URU5UX0ZJRUxEUyA9IHsKICAgICJwcmVwYXJlIjogewogICAgICAgICJ0b29sX2lkIiwKICAgICAgICAib3BlcmF0aW9uIiwKICAgICAgICAidGFyZ2V0IiwKICAgICAgICAicGFyYW1ldGVycyIsCiAgICAgICAgImFnZW50X2lkIiwKICAgICAgICAidGFza19pZCIsCiAgICAgICAgInBvbGljeV9lcG9jaCIsCiAgICAgICAgImF1dGhvcml0eV9leHBpcmVzX2F0X21zIiwKICAgICAgICAiaWRlbXBvdGVuY3lfa2V5IiwKICAgICAgICAidHJhY2VwYXJlbnQiLAogICAgfSwKICAgICJhcHByb3ZlIjogeyJpbnRlbnRfcmVmIiwgInB1cnBvc2UiLCAiZXhwaXJlc19hdF9tcyJ9LAogICAgImNvbW1pdCI6IHsiaW50ZW50X3JlZiIsICJpZGVtcG90ZW5jeV9rZXkiLCAicG9saWN5X2Vwb2NoIiwgInRyYW5zcG9ydF9vdXRjb21lIn0sCiAgICAicmVjb25jaWxlIjogeyJpbnRlbnRfcmVmIiwgImlkZW1wb3RlbmN5X2tleSIsICJvYnNlcnZlZF9zdGF0dXMifSwKICAgICJjb21wZW5zYXRlIjogewogICAgICAgICJpbnRlbnRfcmVmIiwKICAgICAgICAiYXBwcm92YWxfcmVmIiwKICAgICAgICAiaWRlbXBvdGVuY3lfa2V5IiwKICAgICAgICAib3BlcmF0aW9uIiwKICAgICAgICAidHJhbnNwb3J0X291dGNvbWUiLAogICAgfSwKfQoKCmNsYXNzIFNpZGVFZmZlY3RFcnJvcihWYWx1ZUVycm9yKToKICAgICIiIlJhaXNlZCB3aGVuIGFuIGlucHV0IG9yIHJlY2VpcHQgdmlvbGF0ZXMgdGhlIHB1YmxpYyBjb250cmFjdC4iIiIKCgpkZWYgY2Fub25pY2FsKHZhbHVlOiBBbnkpIC0+IGJ5dGVzOgogICAgcmV0dXJuIGpzb24uZHVtcHModmFsdWUsIHNvcnRfa2V5cz1UcnVlLCBzZXBhcmF0b3JzPSgiLCIsICI6IikpLmVuY29kZSgpCgoKZGVmIGRpZ2VzdCh2YWx1ZTogQW55KSAtPiBzdHI6CiAgICBwYXlsb2FkID0gdmFsdWUgaWYgaXNpbnN0YW5jZSh2YWx1ZSwgYnl0ZXMpIGVsc2UgY2Fub25pY2FsKHZhbHVlKQogICAgcmV0dXJuIGhhc2hsaWIuc2hhMjU2KHBheWxvYWQpLmhleGRpZ2VzdCgpCgoKZGVmIGxvYWRfanNvbihzb3VyY2U6IFBhdGgpIC0+IGRpY3Rbc3RyLCBBbnldOgogICAgaWYgc291cmNlLmlzX3N5bWxpbmsoKSBvciBub3Qgc291cmNlLmlzX2ZpbGUoKSBvciBzb3VyY2Uuc3RhdCgpLnN0X3NpemUgPiBNQVhfQllURVM6CiAgICAgICAgcmFpc2UgU2lkZUVmZmVjdEVycm9yKGYiaW52YWxpZCwgb3ZlcnNpemVkLCBvciBzeW1ib2xpYy1saW5rIGlucHV0OiB7c291cmNlfSIpCiAgICB0cnk6CiAgICAgICAgdmFsdWUgPSBqc29uLmxvYWRzKHNvdXJjZS5yZWFkX3RleHQoKSkKICAgIGV4Y2VwdCAoVW5pY29kZURlY29kZUVycm9yLCBqc29uLkpTT05EZWNvZGVFcnJvcikgYXMgZXhjOgogICAgICAgIHJhaXNlIFNpZGVFZmZlY3RFcnJvcihmImludmFsaWQgSlNPTiBpbiB7c291cmNlfToge2V4Y30iKSBmcm9tIGV4YwogICAgaWYgbm90IGlzaW5zdGFuY2UodmFsdWUsIGRpY3QpOgogICAgICAgIHJhaXNlIFNpZGVFZmZlY3RFcnJvcigiZXhwZWN0ZWQgb25lIEpTT04gb2JqZWN0IikKICAgIHJldHVybiB2YWx1ZQoKCmRlZiB3cml0ZV9qc29uKHZhbHVlOiBkaWN0W3N0ciwgQW55XSwgb3V0OiBQYXRoKSAtPiBOb25lOgogICAgaWYgb3V0LmV4aXN0cygpIG9yIG91dC5pc19zeW1saW5rKCk6CiAgICAgICAgcmFpc2UgU2lkZUVmZmVjdEVycm9yKGYicmVmdXNpbmcgdG8gb3ZlcndyaXRlOiB7b3V0fSIpCiAgICBvdXQucGFyZW50Lm1rZGlyKHBhcmVudHM9VHJ1ZSwgZXhpc3Rfb2s9VHJ1ZSkKICAgIG91dC53cml0ZV90ZXh0KGpzb24uZHVtcHModmFsdWUsIGluZGVudD0yKSArICJcbiIpCgoKZGVmIF9leGFjdCh2YWx1ZTogQW55LCBrZXlzOiBzZXRbc3RyXSwgbGFiZWw6IHN0cikgLT4gZGljdFtzdHIsIEFueV06CiAgICBpZiBub3QgaXNpbnN0YW5jZSh2YWx1ZSwgZGljdCkgb3Igc2V0KHZhbHVlKSAhPSBrZXlzOgogICAgICAgIHJhaXNlIFNpZGVFZmZlY3RFcnJvcihmIntsYWJlbH0gZmllbGRzIGRpZmZlciBmcm9tIHRoZSAwLjEgY29udHJhY3QiKQogICAgcmV0dXJuIHZhbHVlCgoKZGVmIF90ZXh0KHZhbHVlOiBBbnksIGxhYmVsOiBzdHIsIGxpbWl0OiBpbnQgPSA0MDApIC0+IHN0cjoKICAgIGlmIG5vdCBpc2luc3RhbmNlKHZhbHVlLCBzdHIpIG9yIG5vdCB2YWx1ZS5zdHJpcCgpIG9yIGxlbih2YWx1ZSkgPiBsaW1pdDoKICAgICAgICByYWlzZSBTaWRlRWZmZWN0RXJyb3IoZiJ7bGFiZWx9IG11c3QgYmUgbm9uLWVtcHR5IHRleHQgb2YgYXQgbW9zdCB7bGltaXR9IGNoYXJhY3RlcnMiKQogICAgcmV0dXJuIHZhbHVlCgoKZGVmIHZhbGlkYXRlX3N1aXRlKHN1aXRlOiBkaWN0W3N0ciwgQW55XSkgLT4gTm9uZToKICAgIF9leGFjdCgKICAgICAgICBzdWl0ZSwKICAgICAgICB7InN1aXRlX3ZlcnNpb24iLCAic3VpdGVfaWQiLCAidGl0bGUiLCAicHJvZmlsZSIsICJjYXNlcyIsICJib3VuZGFyaWVzIn0sCiAgICAgICAgInN1aXRlIiwKICAgICkKICAgIGlmIHN1aXRlWyJzdWl0ZV92ZXJzaW9uIl0gIT0gU1VJVEVfVkVSU0lPTjoKICAgICAgICByYWlzZSBTaWRlRWZmZWN0RXJyb3IoZiJzdWl0ZV92ZXJzaW9uIG11c3QgYmUge1NVSVRFX1ZFUlNJT059IikKICAgIF90ZXh0KHN1aXRlWyJzdWl0ZV9pZCJdLCAic3VpdGVfaWQiLCAxMjApCiAgICBfdGV4dChzdWl0ZVsidGl0bGUiXSwgInRpdGxlIiwgMjQwKQogICAgcHJvZmlsZSA9IF9leGFjdCgKICAgICAgICBzdWl0ZVsicHJvZmlsZSJdLAogICAgICAgIHsKICAgICAgICAgICAgImFnZW50X2lkIiwKICAgICAgICAgICAgInRhc2tfaWQiLAogICAgICAgICAgICAicG9saWN5X2Vwb2NoIiwKICAgICAgICAgICAgImF1dGhvcml0eV9leHBpcmVzX2F0X21zIiwKICAgICAgICAgICAgImFwcHJvdmFsX3JvbGUiLAogICAgICAgICAgICAicmVjb25jaWxlcl9yb2xlIiwKICAgICAgICAgICAgImFwcHJvdmFsX3R0bF9tcyIsCiAgICAgICAgICAgICJpZGVtcG90ZW5jeV9yZXRlbnRpb25fbXMiLAogICAgICAgICAgICAidG9vbHMiLAogICAgICAgIH0sCiAgICAgICAgInByb2ZpbGUiLAogICAgKQogICAgX3RleHQocHJvZmlsZVsiYWdlbnRfaWQiXSwgInByb2ZpbGUuYWdlbnRfaWQiLCAxNjApCiAgICBfdGV4dChwcm9maWxlWyJ0YXNrX2lkIl0sICJwcm9maWxlLnRhc2tfaWQiLCAxNjApCiAgICBhcHByb3ZhbF9yb2xlID0gX3RleHQocHJvZmlsZVsiYXBwcm92YWxfcm9sZSJdLCAicHJvZmlsZS5hcHByb3ZhbF9yb2xlIiwgMTYwKQogICAgaWYgbm90IGFwcHJvdmFsX3JvbGUuc3RhcnRzd2l0aCgiaHVtYW46Iik6CiAgICAgICAgcmFpc2UgU2lkZUVmZmVjdEVycm9yKCJwcm9maWxlLmFwcHJvdmFsX3JvbGUgbXVzdCBuYW1lIGFuIGFjY291bnRhYmxlIGh1bWFuIHJvbGUiKQogICAgX3RleHQocHJvZmlsZVsicmVjb25jaWxlcl9yb2xlIl0sICJwcm9maWxlLnJlY29uY2lsZXJfcm9sZSIsIDE2MCkKICAgIGZvciBrZXkgaW4gKAogICAgICAgICJwb2xpY3lfZXBvY2giLAogICAgICAgICJhdXRob3JpdHlfZXhwaXJlc19hdF9tcyIsCiAgICAgICAgImFwcHJvdmFsX3R0bF9tcyIsCiAgICAgICAgImlkZW1wb3RlbmN5X3JldGVudGlvbl9tcyIsCiAgICApOgogICAgICAgIGlmIG5vdCBpc2luc3RhbmNlKHByb2ZpbGVba2V5XSwgaW50KSBvciBwcm9maWxlW2tleV0gPD0gMDoKICAgICAgICAgICAgcmFpc2UgU2lkZUVmZmVjdEVycm9yKGYicHJvZmlsZS57a2V5fSBtdXN0IGJlIGEgcG9zaXRpdmUgaW50ZWdlciIpCiAgICB0b29scyA9IHByb2ZpbGVbInRvb2xzIl0KICAgIGlmIG5vdCBpc2luc3RhbmNlKHRvb2xzLCBsaXN0KSBvciBub3QgKDEgPD0gbGVuKHRvb2xzKSA8PSAzMCk6CiAgICAgICAgcmFpc2UgU2lkZUVmZmVjdEVycm9yKCJwcm9maWxlLnRvb2xzIG11c3QgY29udGFpbiBiZXR3ZWVuIDEgYW5kIDMwIGVudHJpZXMiKQogICAgdG9vbF9pZHM6IHNldFtzdHJdID0gc2V0KCkKICAgIGZvciBpbmRleCwgdG9vbCBpbiBlbnVtZXJhdGUodG9vbHMpOgogICAgICAgIHRvb2wgPSBfZXhhY3QoCiAgICAgICAgICAgIHRvb2wsCiAgICAgICAgICAgIHsidG9vbF9pZCIsICJvcGVyYXRpb24iLCAiZWZmZWN0X2NsYXNzIiwgImNvbXBlbnNhdGlvbl9vcGVyYXRpb24ifSwKICAgICAgICAgICAgZiJwcm9maWxlLnRvb2xzW3tpbmRleH1dIiwKICAgICAgICApCiAgICAgICAgdG9vbF9pZCA9IF90ZXh0KHRvb2xbInRvb2xfaWQiXSwgZiJwcm9maWxlLnRvb2xzW3tpbmRleH1dLnRvb2xfaWQiLCAxMjApCiAgICAgICAgaWYgdG9vbF9pZCBpbiB0b29sX2lkczoKICAgICAgICAgICAgcmFpc2UgU2lkZUVmZmVjdEVycm9yKGYiZHVwbGljYXRlIHRvb2xfaWQ6IHt0b29sX2lkfSIpCiAgICAgICAgdG9vbF9pZHMuYWRkKHRvb2xfaWQpCiAgICAgICAgX3RleHQodG9vbFsib3BlcmF0aW9uIl0sIGYicHJvZmlsZS50b29sc1t7aW5kZXh9XS5vcGVyYXRpb24iLCAxNjApCiAgICAgICAgaWYgdG9vbFsiZWZmZWN0X2NsYXNzIl0gbm90IGluIHsicmV2ZXJzaWJsZSIsICJpcnJldmVyc2libGUifToKICAgICAgICAgICAgcmFpc2UgU2lkZUVmZmVjdEVycm9yKCJ0b29sIGVmZmVjdF9jbGFzcyBtdXN0IGJlIHJldmVyc2libGUgb3IgaXJyZXZlcnNpYmxlIikKICAgICAgICBjb21wZW5zYXRpb24gPSB0b29sWyJjb21wZW5zYXRpb25fb3BlcmF0aW9uIl0KICAgICAgICBpZiBjb21wZW5zYXRpb24gaXMgbm90IE5vbmU6CiAgICAgICAgICAgIF90ZXh0KGNvbXBlbnNhdGlvbiwgZiJwcm9maWxlLnRvb2xzW3tpbmRleH1dLmNvbXBlbnNhdGlvbl9vcGVyYXRpb24iLCAxNjApCgogICAgYm91bmRhcmllcyA9IF9leGFjdChzdWl0ZVsiYm91bmRhcmllcyJdLCBCT1VOREFSWV9LRVlTLCAiYm91bmRhcmllcyIpCiAgICBpZiBhbnkoYm91bmRhcmllc1trZXldIGlzIG5vdCBUcnVlIGZvciBrZXkgaW4gQk9VTkRBUllfS0VZUyk6CiAgICAgICAgcmFpc2UgU2lkZUVmZmVjdEVycm9yKCJhbGwgc2lkZS1lZmZlY3Qgc2FmZXR5IGJvdW5kYXJpZXMgbXVzdCBiZSB0cnVlIikKICAgIGNhc2VzID0gc3VpdGVbImNhc2VzIl0KICAgIGlmIG5vdCBpc2luc3RhbmNlKGNhc2VzLCBsaXN0KSBvciBub3QgKDYgPD0gbGVuKGNhc2VzKSA8PSA1MCk6CiAgICAgICAgcmFpc2UgU2lkZUVmZmVjdEVycm9yKCJjYXNlcyBtdXN0IGNvbnRhaW4gYmV0d2VlbiA2IGFuZCA1MCBlbnRyaWVzIikKICAgIGNhc2VfaWRzOiBzZXRbc3RyXSA9IHNldCgpCiAgICBldmVudF9pZHM6IHNldFtzdHJdID0gc2V0KCkKICAgIG9ic2VydmVkX2tpbmRzOiBzZXRbc3RyXSA9IHNldCgpCiAgICBmb3IgY2FzZV9pbmRleCwgY2FzZSBpbiBlbnVtZXJhdGUoY2FzZXMpOgogICAgICAgIGNhc2UgPSBfZXhhY3QoY2FzZSwgeyJjYXNlX2lkIiwgInRpdGxlIiwgImV2ZW50cyJ9LCBmImNhc2VzW3tjYXNlX2luZGV4fV0iKQogICAgICAgIGNhc2VfaWQgPSBfdGV4dChjYXNlWyJjYXNlX2lkIl0sIGYiY2FzZXNbe2Nhc2VfaW5kZXh9XS5jYXNlX2lkIiwgMTAwKQogICAgICAgIGlmIGNhc2VfaWQgaW4gY2FzZV9pZHM6CiAgICAgICAgICAgIHJhaXNlIFNpZGVFZmZlY3RFcnJvcihmImR1cGxpY2F0ZSBjYXNlX2lkOiB7Y2FzZV9pZH0iKQogICAgICAgIGNhc2VfaWRzLmFkZChjYXNlX2lkKQogICAgICAgIF90ZXh0KGNhc2VbInRpdGxlIl0sIGYiY2FzZXNbe2Nhc2VfaW5kZXh9XS50aXRsZSIsIDIyMCkKICAgICAgICBldmVudHMgPSBjYXNlWyJldmVudHMiXQogICAgICAgIGlmIG5vdCBpc2luc3RhbmNlKGV2ZW50cywgbGlzdCkgb3Igbm90ICgyIDw9IGxlbihldmVudHMpIDw9IDMwKToKICAgICAgICAgICAgcmFpc2UgU2lkZUVmZmVjdEVycm9yKGYiY2FzZXNbe2Nhc2VfaW5kZXh9XS5ldmVudHMgbXVzdCBjb250YWluIDIgdG8gMzAgZW50cmllcyIpCiAgICAgICAgcHJldmlvdXNfYXQgPSAtMQog